id	kind	status	depends_on	cpp_refs	rust_targets	acceptance	rollback_or_parking	notes
#NEXT.L3.MAPS.001	implementation	complete	#NEXT.L2.DISPATCH.001	/home/server/woltk-trinity-legacy/src/server/game/Grids/NGrid.h; /home/server/woltk-trinity-legacy/src/server/game/Grids/NGrid.cpp; /home/server/woltk-trinity-legacy/src/server/game/Grids/GridStates.cpp; /home/server/woltk-trinity-legacy/src/server/game/Grids/GridStates.h	crates/wow-map/src/grid.rs; crates/wow-map/src/lib.rs	GridStateKind numeric values match C++; GridInfo TimeTracker/relocation timer/unload-lock semantics are tested; NGrid owns 8x8 cells, id, x/y, loaded flag and state; Active/Idle/Removal transitions are behind MapGridHost	cargo test -p wow-map	Full Map skeleton and ObjectGridLoader remain follow-up
#NEXT.L3.MAPS.002	implementation	complete	#NEXT.L3.MAPS.001	/home/server/woltk-trinity-legacy/src/server/game/Maps/Map.cpp; /home/server/woltk-trinity-legacy/src/server/game/Maps/Map.h	crates/wow-map/src/map.rs; crates/wow-map/src/lib.rs	Map skeleton owns pointer-equivalent i_grids[64][64], create/load/unload hooks, expiry reset, ActiveObjectsNearGrid and terrain hook boundary	cargo test -p wow-map	ObjectGridLoader and personal phase tracker remain follow-up
#NEXT.L3.MAPS.003	implementation	complete	#NEXT.L3.MAPS.002	/home/server/woltk-trinity-legacy/src/server/game/Grids/ObjectGridLoader.cpp; /home/server/woltk-trinity-legacy/src/server/game/Grids/ObjectGridLoader.h	crates/wow-map/src/object_grid_loader.rs; crates/wow-map/src/spawn.rs; crates/wow-map/src/lib.rs	ObjectGridLoader::LoadN consumes SpawnStore and NGrid cells without DB queries per cell; loads creature/gameobject/areatrigger GUIDs and corpses; wires through Map lifecycle hook	cargo test -p wow-map	Actual LoadFromDB/MapObject SetCurrentCell/AddToWorld is deferred to canonical entity phase
#NEXT.L3.MAPS.004	implementation	complete	#NEXT.L3.MAPS.002; #NEXT.L3.MAPS.003	/home/server/woltk-trinity-legacy/src/server/game/Maps/Map.cpp; /home/server/woltk-trinity-legacy/src/server/game/Maps/Map.h; /home/server/woltk-trinity-legacy/src/server/game/Phasing/PersonalPhaseTracker.cpp; /home/server/woltk-trinity-legacy/src/server/game/Phasing/PersonalPhaseTracker.h; /home/server/woltk-trinity-legacy/src/server/game/Grids/ObjectGridLoader.cpp	crates/wow-map/src/personal_phase.rs; crates/wow-map/src/object_grid_loader.rs; crates/wow-map/src/map.rs; crates/wow-map/src/lib.rs	Player-triggered EnsureGridLoadedForActiveObject loads personal phase grids instead of only marking the base grid active; one load per owner/grid/phase; unload and one-minute deletion tracking ported	cargo test -p wow-map	Actual personal object ownership on entities is completed in canonical entity phase
#NEXT.L3.MAPS.005	implementation	complete	#NEXT.L3.MAPS.003	/home/server/woltk-trinity-legacy/src/server/game/Grids/ObjectGridLoader.cpp; /home/server/woltk-trinity-legacy/src/server/game/Grids/ObjectGridLoader.h; /home/server/woltk-trinity-legacy/src/server/game/Maps/Map.cpp	crates/wow-map/src/grid_unload.rs; crates/wow-map/src/grid.rs; crates/wow-map/src/lib.rs	Grid unload helpers emit C++-ordered GUID actions for stoper, evacuator, cleaner and unloader; non-corpse grid object sets are cleared	cargo test -p wow-map	Concrete entity method effects are deferred to canonical entity phase
#NEXT.L3.MAPS.006	implementation	pending	#NEXT.L3.MAPS.005	/home/server/woltk-trinity-legacy/src/server/game/Grids/ObjectGridLoader.cpp; /home/server/woltk-trinity-legacy/src/server/game/Grids/ObjectGridLoader.h	crates/wow-map; future wow-entities	Bind grid unload actions to real entity methods once canonical entities exist	cargo test -p wow-map	Depends on canonical entities for full behavior
#NEXT.L3.MAPS.007	implementation	complete	#NEXT.L3.MAPS.002; #NEXT.L3.MAPS.005	/home/server/woltk-trinity-legacy/src/server/game/Maps/MapManager.cpp; /home/server/woltk-trinity-legacy/src/server/game/Maps/MapManager.h	crates/wow-map/src/manager.rs; crates/wow-map/src/lib.rs	Ordered i_maps, create/find/range iteration, serial update/delayed-update, destroy/unload, instance id allocator and scheduled script counter are ported	cargo test -p wow-map	CreateMap(Player*) branches are deferred until Player/Group/InstanceLock/Battleground exist
#NEXT.L3.MAPS.008	implementation	pending	#NEXT.L3.MAPS.007	/home/server/woltk-trinity-legacy/src/server/game/Maps/MapManager.cpp; /home/server/woltk-trinity-legacy/src/server/game/Maps/MapManager.h	crates/wow-map; crates/wow-world	Bind CreateMap(uint32, Player*) decision tree to real Player/Group/InstanceLock/Battleground/DB2 models	cargo test -p wow-map; cargo test -p wow-world	Do not fake player/group/lock behavior
#NEXT.L3.MAPS.009	implementation	pending	#NEXT.L3.MAPS.006; #NEXT.L3.MAPS.007; #NEXT.L3.MAPS.008	/home/server/woltk-trinity-legacy/src/server/game/Maps/MapManager.cpp; /home/server/woltk-trinity-legacy/src/server/game/Maps/MapManager.h	crates/wow-map; crates/wow-world	legacy wow-world map_manager is replaced after new grid lifecycle is authoritative	cargo test -p wow-map; cargo test -p wow-world	No partial replacement that leaves dual map ownership
